No.     Time           Source                Destination           Protocol Length Info
      1 0.000000000    2a07:b944::2:2        2603:1026:207:163::2  TCP      1420   60862 → 443 [ACK] Seq=1 Ack=1 Win=510 Len=1348 TSval=523555212 TSecr=1101200418

Frame 1: 1420 bytes on wire (11360 bits), 1420 bytes captured (11360 bits) on interface proton0, id 0
Raw packet data
Internet Protocol Version 6, Src: 2a07:b944::2:2, Dst: 2603:1026:207:163::2
Transmission Control Protocol, Src Port: 60862, Dst Port: 443, Seq: 1, Ack: 1, Len: 1348

No.     Time           Source                Destination           Protocol Length Info
      2 0.467086564    2603:1026:207:163::2  2a07:b944::2:2        TCP      72     [TCP ACKed unseen segment] 443 → 60862 [ACK] Seq=1 Ack=1827 Win=262 Len=0 TSval=1101244786 TSecr=523555212

Frame 2: 72 bytes on wire (576 bits), 72 bytes captured (576 bits) on interface proton0, id 0
Raw packet data
Internet Protocol Version 6, Src: 2603:1026:207:163::2, Dst: 2a07:b944::2:2
Transmission Control Protocol, Src Port: 443, Dst Port: 60862, Seq: 1, Ack: 1827, Len: 0

No.     Time           Source                Destination           Protocol Length Info
      3 0.467086751    2603:1026:207:163::2  2a07:b944::2:2        TLSv1.3  171    Hello Retry Request, Change Cipher Spec

Frame 3: 171 bytes on wire (1368 bits), 171 bytes captured (1368 bits) on interface proton0, id 0
Raw packet data
Internet Protocol Version 6, Src: 2603:1026:207:163::2, Dst: 2a07:b944::2:2
Transmission Control Protocol, Src Port: 443, Dst Port: 60862, Seq: 1, Ack: 1827, Len: 99
Transport Layer Security

No.     Time           Source                Destination           Protocol Length Info
      4 0.467112324    2a07:b944::2:2        2603:1026:207:163::2  TCP      72     [TCP Previous segment not captured] 60862 → 443 [FIN, ACK] Seq=1827 Ack=1 Win=510 Len=0 TSval=523555679 TSecr=1101244786

Frame 4: 72 bytes on wire (576 bits), 72 bytes captured (576 bits) on interface proton0, id 0
Raw packet data
Internet Protocol Version 6, Src: 2a07:b944::2:2, Dst: 2603:1026:207:163::2
Transmission Control Protocol, Src Port: 60862, Dst Port: 443, Seq: 1827, Ack: 1, Len: 0

No.     Time           Source                Destination           Protocol Length Info
      5 0.467123757    2a07:b944::2:2        2603:1026:207:163::2  TCP      60     60862 → 443 [RST] Seq=1827 Win=0 Len=0

Frame 5: 60 bytes on wire (480 bits), 60 bytes captured (480 bits) on interface proton0, id 0
Raw packet data
Internet Protocol Version 6, Src: 2a07:b944::2:2, Dst: 2603:1026:207:163::2
Transmission Control Protocol, Src Port: 60862, Dst Port: 443, Seq: 1827, Len: 0

No.     Time           Source                Destination           Protocol Length Info
      6 2.412501056    185.159.159.143       10.2.0.2              TCP      64     443 → 52148 [RST, ACK] Seq=1 Ack=1 Win=255 Len=0 TSval=3146826717 TSecr=2966119891 SLE=1349 SRE=1796

Frame 6: 64 bytes on wire (512 bits), 64 bytes captured (512 bits) on interface proton0, id 0
Raw packet data
Internet Protocol Version 4, Src: 185.159.159.143, Dst: 10.2.0.2
Transmission Control Protocol, Src Port: 443, Dst Port: 52148, Seq: 1, Ack: 1, Len: 0

No.     Time           Source                Destination           Protocol Length Info
      7 3.026857791    185.159.159.143       10.2.0.2              TLSv1.2  115    Application Data, Application Data

Frame 7: 115 bytes on wire (920 bits), 115 bytes captured (920 bits) on interface proton0, id 0
Raw packet data
Internet Protocol Version 4, Src: 185.159.159.143, Dst: 10.2.0.2
Transmission Control Protocol, Src Port: 443, Dst Port: 50430, Seq: 1, Ack: 1, Len: 63
Transport Layer Security

No.     Time           Source                Destination           Protocol Length Info
      8 3.026876537    10.2.0.2              185.159.159.143       TCP      52     50430 → 443 [ACK] Seq=1 Ack=64 Win=419 Len=0 TSval=2966227308 TSecr=3146827516

Frame 8: 52 bytes on wire (416 bits), 52 bytes captured (416 bits) on interface proton0, id 0
Raw packet data
Internet Protocol Version 4, Src: 10.2.0.2, Dst: 185.159.159.143
Transmission Control Protocol, Src Port: 50430, Dst Port: 443, Seq: 1, Ack: 64, Len: 0

No.     Time           Source                Destination           Protocol Length Info
      9 3.026881662    185.159.159.143       10.2.0.2              TCP      52     443 → 50430 [FIN, ACK] Seq=64 Ack=1 Win=268 Len=0 TSval=3146827516 TSecr=2966217239

Frame 9: 52 bytes on wire (416 bits), 52 bytes captured (416 bits) on interface proton0, id 0
Raw packet data
Internet Protocol Version 4, Src: 185.159.159.143, Dst: 10.2.0.2
Transmission Control Protocol, Src Port: 443, Dst Port: 50430, Seq: 64, Ack: 1, Len: 0

No.     Time           Source                Destination           Protocol Length Info
     10 3.027301980    10.2.0.2              185.159.159.143       TCP      52     50430 → 443 [FIN, ACK] Seq=1 Ack=65 Win=419 Len=0 TSval=2966227308 TSecr=3146827516

Frame 10: 52 bytes on wire (416 bits), 52 bytes captured (416 bits) on interface proton0, id 0
Raw packet data
Internet Protocol Version 4, Src: 10.2.0.2, Dst: 185.159.159.143
Transmission Control Protocol, Src Port: 50430, Dst Port: 443, Seq: 1, Ack: 65, Len: 0

No.     Time           Source                Destination           Protocol Length Info
     11 3.334633199    185.159.159.143       10.2.0.2              TCP      52     443 → 50430 [ACK] Seq=65 Ack=2 Win=268 Len=0 TSval=3146827926 TSecr=2966227308

Frame 11: 52 bytes on wire (416 bits), 52 bytes captured (416 bits) on interface proton0, id 0
Raw packet data
Internet Protocol Version 4, Src: 185.159.159.143, Dst: 10.2.0.2
Transmission Control Protocol, Src Port: 443, Dst Port: 50430, Seq: 65, Ack: 2, Len: 0

No.     Time           Source                Destination           Protocol Length Info
     12 3.334657372    2603:1020:206:d::1    2a07:b944::2:2        TCP      84     443 → 41504 [RST, ACK] Seq=1 Ack=1 Win=252 Len=0 TSval=697905266 TSecr=2376159272 SLE=1349 SRE=1706

Frame 12: 84 bytes on wire (672 bits), 84 bytes captured (672 bits) on interface proton0, id 0
Raw packet data
Internet Protocol Version 6, Src: 2603:1020:206:d::1, Dst: 2a07:b944::2:2
Transmission Control Protocol, Src Port: 443, Dst Port: 41504, Seq: 1, Ack: 1, Len: 0

No.     Time           Source                Destination           Protocol Length Info
     13 5.632026893    2a07:b944::2:2        2603:1026:c03:7068::2 TCP      1420   57462 → 443 [ACK] Seq=1 Ack=1 Win=510 Len=1348 TSval=3463850817 TSecr=3421904890

Frame 13: 1420 bytes on wire (11360 bits), 1420 bytes captured (11360 bits) on interface proton0, id 0
Raw packet data
Internet Protocol Version 6, Src: 2a07:b944::2:2, Dst: 2603:1026:c03:7068::2
Transmission Control Protocol, Src Port: 57462, Dst Port: 443, Seq: 1, Ack: 1, Len: 1348

No.     Time           Source                Destination           Protocol Length Info
     14 5.910044035    2603:1026:c03:7068::2 2a07:b944::2:2        TCP      72     [TCP ACKed unseen segment] 443 → 57462 [ACK] Seq=1 Ack=1731 Win=262 Len=0 TSval=3421954027 TSecr=3463850817

Frame 14: 72 bytes on wire (576 bits), 72 bytes captured (576 bits) on interface proton0, id 0
Raw packet data
Internet Protocol Version 6, Src: 2603:1026:c03:7068::2, Dst: 2a07:b944::2:2
Transmission Control Protocol, Src Port: 443, Dst Port: 57462, Seq: 1, Ack: 1731, Len: 0

No.     Time           Source                Destination           Protocol Length Info
     15 5.910070493    2a07:b944::2:2        2603:1026:c03:7068::2 TCP      72     [TCP Previous segment not captured] 57462 → 443 [FIN, ACK] Seq=1731 Ack=1 Win=510 Len=0 TSval=3463851095 TSecr=3421954027

Frame 15: 72 bytes on wire (576 bits), 72 bytes captured (576 bits) on interface proton0, id 0
Raw packet data
Internet Protocol Version 6, Src: 2a07:b944::2:2, Dst: 2603:1026:c03:7068::2
Transmission Control Protocol, Src Port: 57462, Dst Port: 443, Seq: 1731, Ack: 1, Len: 0

No.     Time           Source                Destination           Protocol Length Info
     16 5.910077341    2603:1026:c03:7068::2 2a07:b944::2:2        TLSv1.3  171    Hello Retry Request, Change Cipher Spec

Frame 16: 171 bytes on wire (1368 bits), 171 bytes captured (1368 bits) on interface proton0, id 0
Raw packet data
Internet Protocol Version 6, Src: 2603:1026:c03:7068::2, Dst: 2a07:b944::2:2
Transmission Control Protocol, Src Port: 443, Dst Port: 57462, Seq: 1, Ack: 1731, Len: 99
Transport Layer Security

No.     Time           Source                Destination           Protocol Length Info
     17 5.910084991    2a07:b944::2:2        2603:1026:c03:7068::2 TCP      60     57462 → 443 [RST] Seq=1731 Win=0 Len=0

Frame 17: 60 bytes on wire (480 bits), 60 bytes captured (480 bits) on interface proton0, id 0
Raw packet data
Internet Protocol Version 6, Src: 2a07:b944::2:2, Dst: 2603:1026:c03:7068::2
Transmission Control Protocol, Src Port: 57462, Dst Port: 443, Seq: 1731, Len: 0

No.     Time           Source                Destination           Protocol Length Info
     18 6.656018765    10.2.0.2              172.188.215.153       TCP      52     46752 → 443 [ACK] Seq=1 Ack=1 Win=459 Len=0 TSval=1326526304 TSecr=1478516934

Frame 18: 52 bytes on wire (416 bits), 52 bytes captured (416 bits) on interface proton0, id 0
Raw packet data
Internet Protocol Version 4, Src: 10.2.0.2, Dst: 172.188.215.153
Transmission Control Protocol, Src Port: 46752, Dst Port: 443, Seq: 1, Ack: 1, Len: 0

No.     Time           Source                Destination           Protocol Length Info
     19 6.918601588    172.188.215.153       10.2.0.2              TCP      52     [TCP ACKed unseen segment] 443 → 46752 [ACK] Seq=1 Ack=2 Win=268 Len=0 TSval=1478562745 TSecr=1326480794

Frame 19: 52 bytes on wire (416 bits), 52 bytes captured (416 bits) on interface proton0, id 0
Raw packet data
Internet Protocol Version 4, Src: 172.188.215.153, Dst: 10.2.0.2
Transmission Control Protocol, Src Port: 443, Dst Port: 46752, Seq: 1, Ack: 2, Len: 0

No.     Time           Source                Destination           Protocol Length Info
     20 7.788652401    10.2.0.2              185.159.159.143       TLSv1.2  144    Application Data

Frame 20: 144 bytes on wire (1152 bits), 144 bytes captured (1152 bits) on interface proton0, id 0
Raw packet data
Internet Protocol Version 4, Src: 10.2.0.2, Dst: 185.159.159.143
Transmission Control Protocol, Src Port: 55110, Dst Port: 443, Seq: 1, Ack: 1, Len: 92
Transport Layer Security

No.     Time           Source                Destination           Protocol Length Info
     21 7.788752874    10.2.0.2              185.159.159.143       TLSv1.2  769    Application Data

Frame 21: 769 bytes on wire (6152 bits), 769 bytes captured (6152 bits) on interface proton0, id 0
Raw packet data
Internet Protocol Version 4, Src: 10.2.0.2, Dst: 185.159.159.143
Transmission Control Protocol, Src Port: 55110, Dst Port: 443, Seq: 93, Ack: 1, Len: 717
Transport Layer Security

No.     Time           Source                Destination           Protocol Length Info
     22 7.795996751    2409:40d4:11ed:2be7:da11:b4d2:60f3:5236 64:ff9b::acbc:d799    TCP      60     37526 → 443 [RST] Seq=1 Win=0 Len=0

Frame 22: 60 bytes on wire (480 bits), 60 bytes captured (480 bits) on interface proton0, id 0
Raw packet data
Internet Protocol Version 6, Src: 2409:40d4:11ed:2be7:da11:b4d2:60f3:5236, Dst: 64:ff9b::acbc:d799
Transmission Control Protocol, Src Port: 37526, Dst Port: 443, Seq: 1, Len: 0

No.     Time           Source                Destination           Protocol Length Info
     23 7.796130460    185.159.159.143       10.2.0.2              TLSv1.2  76     Application Data

Frame 23: 76 bytes on wire (608 bits), 76 bytes captured (608 bits) on interface proton0, id 0
Raw packet data
Internet Protocol Version 4, Src: 185.159.159.143, Dst: 10.2.0.2
Transmission Control Protocol, Src Port: 443, Dst Port: 55110, Seq: 1, Ack: 1, Len: 24
Transport Layer Security

No.     Time           Source                Destination           Protocol Length Info
     24 7.796137012    10.2.0.2              185.159.159.143       TCP      52     55110 → 443 [ACK] Seq=810 Ack=25 Win=471 Len=0 TSval=2966232077 TSecr=3146832431

Frame 24: 52 bytes on wire (416 bits), 52 bytes captured (416 bits) on interface proton0, id 0
Raw packet data
Internet Protocol Version 4, Src: 10.2.0.2, Dst: 185.159.159.143
Transmission Control Protocol, Src Port: 55110, Dst Port: 443, Seq: 810, Ack: 25, Len: 0

No.     Time           Source                Destination           Protocol Length Info
     25 7.796148455    185.159.159.143       10.2.0.2              TCP      52     443 → 55110 [FIN, ACK] Seq=25 Ack=1 Win=268 Len=0 TSval=3146832431 TSecr=2966202056

Frame 25: 52 bytes on wire (416 bits), 52 bytes captured (416 bits) on interface proton0, id 0
Raw packet data
Internet Protocol Version 4, Src: 185.159.159.143, Dst: 10.2.0.2
Transmission Control Protocol, Src Port: 443, Dst Port: 55110, Seq: 25, Ack: 1, Len: 0

No.     Time           Source                Destination           Protocol Length Info
     26 7.796327646    10.2.0.2              185.159.159.143       TCP      60     57338 → 443 [SYN] Seq=0 Win=64860 Len=0 MSS=1380 SACK_PERM TSval=2966232077 TSecr=0 WS=128

Frame 26: 60 bytes on wire (480 bits), 60 bytes captured (480 bits) on interface proton0, id 0
Raw packet data
Internet Protocol Version 4, Src: 10.2.0.2, Dst: 185.159.159.143
Transmission Control Protocol, Src Port: 57338, Dst Port: 443, Seq: 0, Len: 0

No.     Time           Source                Destination           Protocol Length Info
     27 7.796351059    10.2.0.2              185.159.159.143       TCP      52     55110 → 443 [FIN, ACK] Seq=810 Ack=26 Win=471 Len=0 TSval=2966232077 TSecr=3146832431

Frame 27: 52 bytes on wire (416 bits), 52 bytes captured (416 bits) on interface proton0, id 0
Raw packet data
Internet Protocol Version 4, Src: 10.2.0.2, Dst: 185.159.159.143
Transmission Control Protocol, Src Port: 55110, Dst Port: 443, Seq: 810, Ack: 26, Len: 0

No.     Time           Source                Destination           Protocol Length Info
     28 8.044651049    185.159.159.143       10.2.0.2              TCP      52     443 → 55110 [RST, ACK] Seq=26 Ack=810 Win=268 Len=0 TSval=3146832695 TSecr=2966232069

Frame 28: 52 bytes on wire (416 bits), 52 bytes captured (416 bits) on interface proton0, id 0
Raw packet data
Internet Protocol Version 4, Src: 185.159.159.143, Dst: 10.2.0.2
Transmission Control Protocol, Src Port: 443, Dst Port: 55110, Seq: 26, Ack: 810, Len: 0

No.     Time           Source                Destination           Protocol Length Info
     29 8.044651257    185.159.159.143       10.2.0.2              TCP      60     443 → 57338 [SYN, ACK] Seq=0 Ack=1 Win=65084 Len=0 MSS=1240 SACK_PERM TSval=3146832699 TSecr=2966232077 WS=256

Frame 29: 60 bytes on wire (480 bits), 60 bytes captured (480 bits) on interface proton0, id 0
Raw packet data
Internet Protocol Version 4, Src: 185.159.159.143, Dst: 10.2.0.2
Transmission Control Protocol, Src Port: 443, Dst Port: 57338, Seq: 0, Ack: 1, Len: 0

No.     Time           Source                Destination           Protocol Length Info
     30 8.044690018    10.2.0.2              185.159.159.143       TCP      52     57338 → 443 [ACK] Seq=1 Ack=1 Win=64896 Len=0 TSval=2966232325 TSecr=3146832699

Frame 30: 52 bytes on wire (416 bits), 52 bytes captured (416 bits) on interface proton0, id 0
Raw packet data
Internet Protocol Version 4, Src: 10.2.0.2, Dst: 185.159.159.143
Transmission Control Protocol, Src Port: 57338, Dst Port: 443, Seq: 1, Ack: 1, Len: 0

No.     Time           Source                Destination           Protocol Length Info
     31 8.045290748    10.2.0.2              185.159.159.143       TLSv1.3  2150   Client Hello (SNI=account.protonvpn.com)

Frame 31: 2150 bytes on wire (17200 bits), 2150 bytes captured (17200 bits) on interface proton0, id 0
Raw packet data
Internet Protocol Version 4, Src: 10.2.0.2, Dst: 185.159.159.143
Transmission Control Protocol, Src Port: 57338, Dst Port: 443, Seq: 1, Ack: 1, Len: 2098
Transport Layer Security

No.     Time           Source                Destination           Protocol Length Info
     32 8.352284503    2409:40d4:11ed:2be7:da11:b4d2:60f3:5236 64:ff9b::acbc:d799    TCP      60     37526 → 443 [RST] Seq=1 Win=0 Len=0

Frame 32: 60 bytes on wire (480 bits), 60 bytes captured (480 bits) on interface proton0, id 0
Raw packet data
Internet Protocol Version 6, Src: 2409:40d4:11ed:2be7:da11:b4d2:60f3:5236, Dst: 64:ff9b::acbc:d799
Transmission Control Protocol, Src Port: 37526, Dst Port: 443, Seq: 1, Len: 0

No.     Time           Source                Destination           Protocol Length Info
     33 8.352457318    185.159.159.143       10.2.0.2              TCP      52     443 → 57338 [ACK] Seq=1 Ack=1229 Win=66816 Len=0 TSval=3146832948 TSecr=2966232326

Frame 33: 52 bytes on wire (416 bits), 52 bytes captured (416 bits) on interface proton0, id 0
Raw packet data
Internet Protocol Version 4, Src: 185.159.159.143, Dst: 10.2.0.2
Transmission Control Protocol, Src Port: 443, Dst Port: 57338, Seq: 1, Ack: 1229, Len: 0

No.     Time           Source                Destination           Protocol Length Info
     34 8.352457451    185.159.159.143       10.2.0.2              TCP      52     443 → 57338 [ACK] Seq=1 Ack=2099 Win=68608 Len=0 TSval=3146832962 TSecr=2966232326

Frame 34: 52 bytes on wire (416 bits), 52 bytes captured (416 bits) on interface proton0, id 0
Raw packet data
Internet Protocol Version 4, Src: 185.159.159.143, Dst: 10.2.0.2
Transmission Control Protocol, Src Port: 443, Dst Port: 57338, Seq: 1, Ack: 2099, Len: 0

No.     Time           Source                Destination           Protocol Length Info
     35 8.352486625    185.159.159.143       10.2.0.2              TLSv1.3  306    Server Hello, Change Cipher Spec, Application Data, Application Data

Frame 35: 306 bytes on wire (2448 bits), 306 bytes captured (2448 bits) on interface proton0, id 0
Raw packet data
Internet Protocol Version 4, Src: 185.159.159.143, Dst: 10.2.0.2
Transmission Control Protocol, Src Port: 443, Dst Port: 57338, Seq: 1, Ack: 2099, Len: 254
Transport Layer Security

No.     Time           Source                Destination           Protocol Length Info
     36 8.352496433    10.2.0.2              185.159.159.143       TCP      52     57338 → 443 [ACK] Seq=2099 Ack=255 Win=64768 Len=0 TSval=2966232633 TSecr=3146832974

Frame 36: 52 bytes on wire (416 bits), 52 bytes captured (416 bits) on interface proton0, id 0
Raw packet data
Internet Protocol Version 4, Src: 10.2.0.2, Dst: 185.159.159.143
Transmission Control Protocol, Src Port: 57338, Dst Port: 443, Seq: 2099, Ack: 255, Len: 0

No.     Time           Source                Destination           Protocol Length Info
     37 8.352712626    10.2.0.2              185.159.159.143       TLSv1.3  132    Change Cipher Spec, Application Data

Frame 37: 132 bytes on wire (1056 bits), 132 bytes captured (1056 bits) on interface proton0, id 0
Raw packet data
Internet Protocol Version 4, Src: 10.2.0.2, Dst: 185.159.159.143
Transmission Control Protocol, Src Port: 57338, Dst Port: 443, Seq: 2099, Ack: 255, Len: 80
Transport Layer Security

No.     Time           Source                Destination           Protocol Length Info
     38 8.352793576    10.2.0.2              185.159.159.143       TLSv1.3  144    Application Data

Frame 38: 144 bytes on wire (1152 bits), 144 bytes captured (1152 bits) on interface proton0, id 0
Raw packet data
Internet Protocol Version 4, Src: 10.2.0.2, Dst: 185.159.159.143
Transmission Control Protocol, Src Port: 57338, Dst Port: 443, Seq: 2179, Ack: 255, Len: 92
Transport Layer Security

No.     Time           Source                Destination           Protocol Length Info
     39 8.353576705    10.2.0.2              185.159.159.143       TLSv1.3  769    Application Data

Frame 39: 769 bytes on wire (6152 bits), 769 bytes captured (6152 bits) on interface proton0, id 0
Raw packet data
Internet Protocol Version 4, Src: 10.2.0.2, Dst: 185.159.159.143
Transmission Control Protocol, Src Port: 57338, Dst Port: 443, Seq: 2271, Ack: 255, Len: 717
Transport Layer Security

No.     Time           Source                Destination           Protocol Length Info
     40 8.581436745    185.159.159.143       10.2.0.2              TCP      52     443 → 57338 [ACK] Seq=255 Ack=2271 Win=68608 Len=0 TSval=3146833250 TSecr=2966232633

Frame 40: 52 bytes on wire (416 bits), 52 bytes captured (416 bits) on interface proton0, id 0
Raw packet data
Internet Protocol Version 4, Src: 185.159.159.143, Dst: 10.2.0.2
Transmission Control Protocol, Src Port: 443, Dst Port: 57338, Seq: 255, Ack: 2271, Len: 0

No.     Time           Source                Destination           Protocol Length Info
     41 8.648048668    185.159.159.143       10.2.0.2              TCP      52     443 → 57338 [ACK] Seq=255 Ack=2988 Win=68608 Len=0 TSval=3146833303 TSecr=2966232634

Frame 41: 52 bytes on wire (416 bits), 52 bytes captured (416 bits) on interface proton0, id 0
Raw packet data
Internet Protocol Version 4, Src: 185.159.159.143, Dst: 10.2.0.2
Transmission Control Protocol, Src Port: 443, Dst Port: 57338, Seq: 255, Ack: 2988, Len: 0

No.     Time           Source                Destination           Protocol Length Info
     42 8.648048892    185.159.159.143       10.2.0.2              TLSv1.3  116    Application Data

Frame 42: 116 bytes on wire (928 bits), 116 bytes captured (928 bits) on interface proton0, id 0
Raw packet data
Internet Protocol Version 4, Src: 185.159.159.143, Dst: 10.2.0.2
Transmission Control Protocol, Src Port: 443, Dst Port: 57338, Seq: 255, Ack: 2988, Len: 64
Transport Layer Security

No.     Time           Source                Destination           Protocol Length Info
     43 8.648305070    10.2.0.2              185.159.159.143       TLSv1.3  83     Application Data

Frame 43: 83 bytes on wire (664 bits), 83 bytes captured (664 bits) on interface proton0, id 0
Raw packet data
Internet Protocol Version 4, Src: 10.2.0.2, Dst: 185.159.159.143
Transmission Control Protocol, Src Port: 57338, Dst Port: 443, Seq: 2988, Ack: 319, Len: 31
Transport Layer Security

No.     Time           Source                Destination           Protocol Length Info
     44 8.650589267    185.159.159.143       10.2.0.2              TCP      1280   443 → 57338 [ACK] Seq=319 Ack=2988 Win=68608 Len=1228 TSval=3146833353 TSecr=2966232634 [TCP PDU reassembled in 47]

Frame 44: 1280 bytes on wire (10240 bits), 1280 bytes captured (10240 bits) on interface proton0, id 0
Raw packet data
Internet Protocol Version 4, Src: 185.159.159.143, Dst: 10.2.0.2
Transmission Control Protocol, Src Port: 443, Dst Port: 57338, Seq: 319, Ack: 2988, Len: 1228

No.     Time           Source                Destination           Protocol Length Info
     45 8.691029480    10.2.0.2              185.159.159.143       TCP      52     57338 → 443 [ACK] Seq=3019 Ack=1547 Win=63616 Len=0 TSval=2966232972 TSecr=3146833353

Frame 45: 52 bytes on wire (416 bits), 52 bytes captured (416 bits) on interface proton0, id 0
Raw packet data
Internet Protocol Version 4, Src: 10.2.0.2, Dst: 185.159.159.143
Transmission Control Protocol, Src Port: 57338, Dst Port: 443, Seq: 3019, Ack: 1547, Len: 0

No.     Time           Source                Destination           Protocol Length Info
     46 8.798521799    2409:40d4:11ed:2be7:da11:b4d2:60f3:5236 64:ff9b::acbc:d799    TCP      60     37526 → 443 [RST] Seq=1 Win=0 Len=0

Frame 46: 60 bytes on wire (480 bits), 60 bytes captured (480 bits) on interface proton0, id 0
Raw packet data
Internet Protocol Version 6, Src: 2409:40d4:11ed:2be7:da11:b4d2:60f3:5236, Dst: 64:ff9b::acbc:d799
Transmission Control Protocol, Src Port: 37526, Dst Port: 443, Seq: 1, Len: 0

No.     Time           Source                Destination           Protocol Length Info
     47 8.851492782    185.159.159.143       10.2.0.2              TLSv1.3  364    Application Data

Frame 47: 364 bytes on wire (2912 bits), 364 bytes captured (2912 bits) on interface proton0, id 0
Raw packet data
Internet Protocol Version 4, Src: 185.159.159.143, Dst: 10.2.0.2
Transmission Control Protocol, Src Port: 443, Dst Port: 57338, Seq: 1547, Ack: 3019, Len: 312
[2 Reassembled TCP Segments (1540 bytes): #44(1228), #47(312)]
Transport Layer Security

No.     Time           Source                Destination           Protocol Length Info
     48 8.851511812    10.2.0.2              185.159.159.143       TCP      52     57338 → 443 [ACK] Seq=3019 Ack=1859 Win=63360 Len=0 TSval=2966233132 TSecr=3146833553

Frame 48: 52 bytes on wire (416 bits), 52 bytes captured (416 bits) on interface proton0, id 0
Raw packet data
Internet Protocol Version 4, Src: 10.2.0.2, Dst: 185.159.159.143
Transmission Control Protocol, Src Port: 57338, Dst Port: 443, Seq: 3019, Ack: 1859, Len: 0

No.     Time           Source                Destination           Protocol Length Info
     49 10.092472530   2409:40d4:11ed:2be7:da11:b4d2:60f3:5236 64:ff9b::acbc:d799    TCP      60     37526 → 443 [RST] Seq=1 Win=0 Len=0

Frame 49: 60 bytes on wire (480 bits), 60 bytes captured (480 bits) on interface proton0, id 0
Raw packet data
Internet Protocol Version 6, Src: 2409:40d4:11ed:2be7:da11:b4d2:60f3:5236, Dst: 64:ff9b::acbc:d799
Transmission Control Protocol, Src Port: 37526, Dst Port: 443, Seq: 1, Len: 0

No.     Time           Source                Destination           Protocol Length Info
     50 12.159999455   10.2.0.2              172.211.123.250       TCP      52     51310 → 443 [ACK] Seq=1 Ack=1 Win=457 Len=0 TSval=150936404 TSecr=2302899660

Frame 50: 52 bytes on wire (416 bits), 52 bytes captured (416 bits) on interface proton0, id 0
Raw packet data
Internet Protocol Version 4, Src: 10.2.0.2, Dst: 172.211.123.250
Transmission Control Protocol, Src Port: 51310, Dst Port: 443, Seq: 1, Ack: 1, Len: 0

No.     Time           Source                Destination           Protocol Length Info
     51 12.249977499   2409:40d4:11ed:2be7:da11:b4d2:60f3:5236 64:ff9b::acbc:d799    TCP      60     37526 → 443 [RST] Seq=1 Win=0 Len=0

Frame 51: 60 bytes on wire (480 bits), 60 bytes captured (480 bits) on interface proton0, id 0
Raw packet data
Internet Protocol Version 6, Src: 2409:40d4:11ed:2be7:da11:b4d2:60f3:5236, Dst: 64:ff9b::acbc:d799
Transmission Control Protocol, Src Port: 37526, Dst Port: 443, Seq: 1, Len: 0

No.     Time           Source                Destination           Protocol Length Info
     52 12.549876360   172.211.123.250       10.2.0.2              TCP      52     [TCP ACKed unseen segment] 443 → 51310 [ACK] Seq=1 Ack=2 Win=268 Len=0 TSval=2302945073 TSecr=150891432

Frame 52: 52 bytes on wire (416 bits), 52 bytes captured (416 bits) on interface proton0, id 0
Raw packet data
Internet Protocol Version 4, Src: 172.211.123.250, Dst: 10.2.0.2
Transmission Control Protocol, Src Port: 443, Dst Port: 51310, Seq: 1, Ack: 2, Len: 0

No.     Time           Source                Destination           Protocol Length Info
     53 14.335882911   2a07:b944::2:2        2603:1020:206:d::1    TCP      1420   53852 → 443 [ACK] Seq=1 Ack=1 Win=510 Len=1348 TSval=2376301554 TSecr=697865093

Frame 53: 1420 bytes on wire (11360 bits), 1420 bytes captured (11360 bits) on interface proton0, id 0
Raw packet data
Internet Protocol Version 6, Src: 2a07:b944::2:2, Dst: 2603:1020:206:d::1
Transmission Control Protocol, Src Port: 53852, Dst Port: 443, Seq: 1, Ack: 1, Len: 1348

No.     Time           Source                Destination           Protocol Length Info
     54 14.809704932   2603:1020:206:d::1    2a07:b944::2:2        TCP      72     [TCP ACKed unseen segment] 443 → 53852 [ACK] Seq=1 Ack=1706 Win=262 Len=0 TSval=697916558 TSecr=2376301554

Frame 54: 72 bytes on wire (576 bits), 72 bytes captured (576 bits) on interface proton0, id 0
Raw packet data
Internet Protocol Version 6, Src: 2603:1020:206:d::1, Dst: 2a07:b944::2:2
Transmission Control Protocol, Src Port: 443, Dst Port: 53852, Seq: 1, Ack: 1706, Len: 0

No.     Time           Source                Destination           Protocol Length Info
     55 14.809705131   2603:1020:206:d::1    2a07:b944::2:2        TCP      72     443 → 53852 [RST, ACK] Seq=1 Ack=1706 Win=262 Len=0 TSval=697916561 TSecr=2376301554

Frame 55: 72 bytes on wire (576 bits), 72 bytes captured (576 bits) on interface proton0, id 0
Raw packet data
Internet Protocol Version 6, Src: 2603:1020:206:d::1, Dst: 2a07:b944::2:2
Transmission Control Protocol, Src Port: 443, Dst Port: 53852, Seq: 1, Ack: 1706, Len: 0

No.     Time           Source                Destination           Protocol Length Info
     56 14.809705153   2603:1020:206:d::1    2a07:b944::2:2        TCP      84     443 → 49750 [RST, ACK] Seq=1 Ack=1 Win=252 Len=0 TSval=697916626 TSecr=2376170673 SLE=1349 SRE=1738

Frame 56: 84 bytes on wire (672 bits), 84 bytes captured (672 bits) on interface proton0, id 0
Raw packet data
Internet Protocol Version 6, Src: 2603:1020:206:d::1, Dst: 2a07:b944::2:2
Transmission Control Protocol, Src Port: 443, Dst Port: 49750, Seq: 1, Ack: 1, Len: 0

No.     Time           Source                Destination           Protocol Length Info
     57 14.809730262   2a07:b944::2:2        2603:1020:206:d::1    TCP      72     [TCP Previous segment not captured] 53852 → 443 [FIN, ACK] Seq=1706 Ack=1 Win=510 Len=0 TSval=2376302027 TSecr=697916558

Frame 57: 72 bytes on wire (576 bits), 72 bytes captured (576 bits) on interface proton0, id 0
Raw packet data
Internet Protocol Version 6, Src: 2a07:b944::2:2, Dst: 2603:1020:206:d::1
Transmission Control Protocol, Src Port: 53852, Dst Port: 443, Seq: 1706, Ack: 1, Len: 0

No.     Time           Source                Destination           Protocol Length Info
     58 14.847807365   2a07:b944::2:2        2603:1026:c03:6025::2 TCP      1420   56214 → 443 [ACK] Seq=1 Ack=1 Win=510 Len=1348 TSval=3179401359 TSecr=957375868

Frame 58: 1420 bytes on wire (11360 bits), 1420 bytes captured (11360 bits) on interface proton0, id 0
Raw packet data
Internet Protocol Version 6, Src: 2a07:b944::2:2, Dst: 2603:1026:c03:6025::2
Transmission Control Protocol, Src Port: 56214, Dst Port: 443, Seq: 1, Ack: 1, Len: 1348

No.     Time           Source                Destination           Protocol Length Info
     59 14.850836050   10.2.0.2              20.189.173.11         TCP      52     53122 → 443 [ACK] Seq=1 Ack=1 Win=456 Len=0 TSval=438174713 TSecr=3572302875

Frame 59: 52 bytes on wire (416 bits), 52 bytes captured (416 bits) on interface proton0, id 0
Raw packet data
Internet Protocol Version 4, Src: 10.2.0.2, Dst: 20.189.173.11
Transmission Control Protocol, Src Port: 53122, Dst Port: 443, Seq: 1, Ack: 1, Len: 0

No.     Time           Source                Destination           Protocol Length Info
     60 15.073505710   20.189.173.11         10.2.0.2              TCP      52     [TCP ACKed unseen segment] 443 → 53122 [ACK] Seq=1 Ack=2 Win=268 Len=0 TSval=3572348104 TSecr=438129752

Frame 60: 52 bytes on wire (416 bits), 52 bytes captured (416 bits) on interface proton0, id 0
Raw packet data
Internet Protocol Version 4, Src: 20.189.173.11, Dst: 10.2.0.2
Transmission Control Protocol, Src Port: 443, Dst Port: 53122, Seq: 1, Ack: 2, Len: 0

No.     Time           Source                Destination           Protocol Length Info
     61 15.097328523   2603:1026:c03:6025::2 2a07:b944::2:2        TCP      72     [TCP ACKed unseen segment] 443 → 56214 [ACK] Seq=1 Ack=2278 Win=262 Len=0 TSval=957456706 TSecr=3179401359

Frame 61: 72 bytes on wire (576 bits), 72 bytes captured (576 bits) on interface proton0, id 0
Raw packet data
Internet Protocol Version 6, Src: 2603:1026:c03:6025::2, Dst: 2a07:b944::2:2
Transmission Control Protocol, Src Port: 443, Dst Port: 56214, Seq: 1, Ack: 2278, Len: 0

No.     Time           Source                Destination           Protocol Length Info
     62 15.097360931   2a07:b944::2:2        2603:1026:c03:6025::2 TCP      72     [TCP Previous segment not captured] 56214 → 443 [FIN, ACK] Seq=2278 Ack=1 Win=510 Len=0 TSval=3179401608 TSecr=957456706

Frame 62: 72 bytes on wire (576 bits), 72 bytes captured (576 bits) on interface proton0, id 0
Raw packet data
Internet Protocol Version 6, Src: 2a07:b944::2:2, Dst: 2603:1026:c03:6025::2
Transmission Control Protocol, Src Port: 56214, Dst Port: 443, Seq: 2278, Ack: 1, Len: 0

No.     Time           Source                Destination           Protocol Length Info
     63 15.097369940   2603:1026:c03:6025::2 2a07:b944::2:2        TLSv1.3  171    Hello Retry Request, Change Cipher Spec

Frame 63: 171 bytes on wire (1368 bits), 171 bytes captured (1368 bits) on interface proton0, id 0
Raw packet data
Internet Protocol Version 6, Src: 2603:1026:c03:6025::2, Dst: 2a07:b944::2:2
Transmission Control Protocol, Src Port: 443, Dst Port: 56214, Seq: 1, Ack: 2278, Len: 99
Transport Layer Security

No.     Time           Source                Destination           Protocol Length Info
     64 15.097379214   2a07:b944::2:2        2603:1026:c03:6025::2 TCP      60     56214 → 443 [RST] Seq=2278 Win=0 Len=0

Frame 64: 60 bytes on wire (480 bits), 60 bytes captured (480 bits) on interface proton0, id 0
Raw packet data
Internet Protocol Version 6, Src: 2a07:b944::2:2, Dst: 2603:1026:c03:6025::2
Transmission Control Protocol, Src Port: 56214, Dst Port: 443, Seq: 2278, Len: 0

No.     Time           Source                Destination           Protocol Length Info
     65 15.159801358   10.2.0.2              20.189.173.11         TCP      52     53130 → 443 [ACK] Seq=1 Ack=1 Win=458 Len=0 TSval=438175022 TSecr=3572303127

Frame 65: 52 bytes on wire (416 bits), 52 bytes captured (416 bits) on interface proton0, id 0
Raw packet data
Internet Protocol Version 4, Src: 10.2.0.2, Dst: 20.189.173.11
Transmission Control Protocol, Src Port: 53130, Dst Port: 443, Seq: 1, Ack: 1, Len: 0

No.     Time           Source                Destination           Protocol Length Info
     66 15.420989032   20.189.173.11         10.2.0.2              TCP      52     [TCP ACKed unseen segment] 443 → 53130 [ACK] Seq=1 Ack=2 Win=268 Len=0 TSval=3572348362 TSecr=438130021

Frame 66: 52 bytes on wire (416 bits), 52 bytes captured (416 bits) on interface proton0, id 0
Raw packet data
Internet Protocol Version 4, Src: 20.189.173.11, Dst: 10.2.0.2
Transmission Control Protocol, Src Port: 443, Dst Port: 53130, Seq: 1, Ack: 2, Len: 0

No.     Time           Source                Destination           Protocol Length Info
     67 16.236390499   2409:40d4:11ed:2be7:da11:b4d2:60f3:5236 64:ff9b::acbc:d799    TCP      60     37526 → 443 [RST] Seq=1 Win=0 Len=0

Frame 67: 60 bytes on wire (480 bits), 60 bytes captured (480 bits) on interface proton0, id 0
Raw packet data
Internet Protocol Version 6, Src: 2409:40d4:11ed:2be7:da11:b4d2:60f3:5236, Dst: 64:ff9b::acbc:d799
Transmission Control Protocol, Src Port: 37526, Dst Port: 443, Seq: 1, Len: 0

No.     Time           Source                Destination           Protocol Length Info
     68 18.316209864   2409:40d4:11ed:2be7:da11:b4d2:60f3:5236 64:ff9b::acbc:d799    TCP      60     37526 → 443 [RST] Seq=1 Win=0 Len=0

Frame 68: 60 bytes on wire (480 bits), 60 bytes captured (480 bits) on interface proton0, id 0
Raw packet data
Internet Protocol Version 6, Src: 2409:40d4:11ed:2be7:da11:b4d2:60f3:5236, Dst: 64:ff9b::acbc:d799
Transmission Control Protocol, Src Port: 37526, Dst Port: 443, Seq: 1, Len: 0

No.     Time           Source                Destination           Protocol Length Info
     69 18.694542644   185.159.159.143       10.2.0.2              TLSv1.3  115    Application Data, Application Data

Frame 69: 115 bytes on wire (920 bits), 115 bytes captured (920 bits) on interface proton0, id 0
Raw packet data
Internet Protocol Version 4, Src: 185.159.159.143, Dst: 10.2.0.2
Transmission Control Protocol, Src Port: 443, Dst Port: 57338, Seq: 1859, Ack: 3019, Len: 63
Transport Layer Security

No.     Time           Source                Destination           Protocol Length Info
     70 18.694542835   185.159.159.143       10.2.0.2              TCP      52     443 → 57338 [FIN, ACK] Seq=1922 Ack=3019 Win=68608 Len=0 TSval=3146843355 TSecr=2966233132

Frame 70: 52 bytes on wire (416 bits), 52 bytes captured (416 bits) on interface proton0, id 0
Raw packet data
Internet Protocol Version 4, Src: 185.159.159.143, Dst: 10.2.0.2
Transmission Control Protocol, Src Port: 443, Dst Port: 57338, Seq: 1922, Ack: 3019, Len: 0

No.     Time           Source                Destination           Protocol Length Info
     71 18.694563347   10.2.0.2              185.159.159.143       TCP      52     57338 → 443 [ACK] Seq=3019 Ack=1922 Win=63360 Len=0 TSval=2966242975 TSecr=3146843355

Frame 71: 52 bytes on wire (416 bits), 52 bytes captured (416 bits) on interface proton0, id 0
Raw packet data
Internet Protocol Version 4, Src: 10.2.0.2, Dst: 185.159.159.143
Transmission Control Protocol, Src Port: 57338, Dst Port: 443, Seq: 3019, Ack: 1922, Len: 0

No.     Time           Source                Destination           Protocol Length Info
     72 18.694756301   10.2.0.2              185.159.159.143       TCP      52     57338 → 443 [FIN, ACK] Seq=3019 Ack=1923 Win=63360 Len=0 TSval=2966242975 TSecr=3146843355

Frame 72: 52 bytes on wire (416 bits), 52 bytes captured (416 bits) on interface proton0, id 0
Raw packet data
Internet Protocol Version 4, Src: 10.2.0.2, Dst: 185.159.159.143
Transmission Control Protocol, Src Port: 57338, Dst Port: 443, Seq: 3019, Ack: 1923, Len: 0

No.     Time           Source                Destination           Protocol Length Info
     73 19.002500087   185.159.159.143       10.2.0.2              TCP      52     443 → 57338 [ACK] Seq=1923 Ack=3020 Win=68608 Len=0 TSval=3146843587 TSecr=2966242975

Frame 73: 52 bytes on wire (416 bits), 52 bytes captured (416 bits) on interface proton0, id 0
Raw packet data
Internet Protocol Version 4, Src: 185.159.159.143, Dst: 10.2.0.2
Transmission Control Protocol, Src Port: 443, Dst Port: 57338, Seq: 1923, Ack: 3020, Len: 0

No.     Time           Source                Destination           Protocol Length Info
     74 23.200402730   185.159.159.143       10.2.0.2              TLSv1.2  76     Application Data

Frame 74: 76 bytes on wire (608 bits), 76 bytes captured (608 bits) on interface proton0, id 0
Raw packet data
Internet Protocol Version 4, Src: 185.159.159.143, Dst: 10.2.0.2
Transmission Control Protocol, Src Port: 443, Dst Port: 50442, Seq: 1, Ack: 1, Len: 24
Transport Layer Security

No.     Time           Source                Destination           Protocol Length Info
     75 23.200420067   10.2.0.2              185.159.159.143       TCP      52     50442 → 443 [ACK] Seq=1 Ack=25 Win=469 Len=0 TSval=2966247481 TSecr=3146847504

Frame 75: 52 bytes on wire (416 bits), 52 bytes captured (416 bits) on interface proton0, id 0
Raw packet data
Internet Protocol Version 4, Src: 10.2.0.2, Dst: 185.159.159.143
Transmission Control Protocol, Src Port: 50442, Dst Port: 443, Seq: 1, Ack: 25, Len: 0

No.     Time           Source                Destination           Protocol Length Info
     76 23.200423190   185.159.159.143       10.2.0.2              TCP      52     443 → 50442 [FIN, ACK] Seq=25 Ack=1 Win=268 Len=0 TSval=3146847504 TSecr=2966217158

Frame 76: 52 bytes on wire (416 bits), 52 bytes captured (416 bits) on interface proton0, id 0
Raw packet data
Internet Protocol Version 4, Src: 185.159.159.143, Dst: 10.2.0.2
Transmission Control Protocol, Src Port: 443, Dst Port: 50442, Seq: 25, Ack: 1, Len: 0

No.     Time           Source                Destination           Protocol Length Info
     77 23.240808155   10.2.0.2              185.159.159.143       TCP      52     50442 → 443 [ACK] Seq=1 Ack=26 Win=469 Len=0 TSval=2966247522 TSecr=3146847504

